{"schema_version":"1","command":"setup.plan","operation_id":null,"status":"complete","data":{"actions":[],"catalogue_revision":null,"dependencies":[{"dependency":"ffmpeg","disposition":"manual_selection_required","next_step":"FFmpeg was found, but its check did not finish before the deadline the tool checks share: it did not answer in time, or it was not started because the time had run out. This plan cannot tell whether it works, so it decides nothing for it and proposes no install because of it. A first run after an install or restart can be slow. Run setup check until it answers (it can be given more time with --timeout-seconds, up to 60), then run setup plan again.","required_authority":"user","status":"timed_out"},{"dependency":"ffprobe","disposition":"manual_selection_required","next_step":"FFprobe was found, but its check did not finish before the deadline the tool checks share: it did not answer in time, or it was not started because the time had run out. This plan cannot tell whether it works, so it decides nothing for it and proposes no install because of it. A first run after an install or restart can be slow. Run setup check until it answers (it can be given more time with --timeout-seconds, up to 60), then run setup plan again.","required_authority":"user","status":"timed_out"},{"dependency":"whisper","disposition":"manual_selection_required","next_step":"Install a trusted whisper.cpp CLI or register a working one with setup configure whisper --executable <absolute-path>, then run setup check. No need to search folders: ask the user where it is. A supplied transcript can skip local ASR.","required_authority":"user","status":"missing"}],"install_needed":false,"local_asr_model":{"disposition":"manual_selection_required","next_step":"For local ASR, configure trusted model weights with setup configure-model --file <absolute-path>. A supplied transcript can skip local ASR.","required_authority":"user","status":"missing"},"managed_install":"unavailable_target","operator_decision_required":null,"optional_components":[{"actions":[],"add_command":null,"download_bytes":null,"installs":["js_runtime_deno","yt_dlp"],"licences":[],"name":"online_links","next_step":"This plan cannot include it here. A managed yt-dlp is offered on Ubuntu 24.04 x86-64 only. Direct HTTPS video links (ingest --url) work without it, as does every local file.","purpose":"Fetches a video from a public web page (YouTube and other sites) when you give VSift a link with ingest --url, using yt-dlp and the JavaScript runtime it needs. Direct HTTPS video links work without it.","status":"unavailable","summary":"Not available here: yt-dlp (GPL-3.0-or-later, with the MIT-licensed Deno runtime) fetches videos from YouTube and other sites when you give VSift a link. Downloading is subject to each site's terms.","terms_notice":"Downloading from a site is subject to that site's terms, which are yours to follow. VSift does not get round sign-in, DRM, age, region or bot checks."}],"plan_digest":null,"profile":"desktop","readiness":"blocked","stop_new_plans_at":null,"target":"windows_x86_64","verification_scope":"executable_probe_and_reviewed_catalogue"},"warnings":[],"error":null,"coverage":null,"lifecycle":null}
